PubmedID,Title,Publication Date,Authors,Email,Email Domain,Non-Academic Authors,Company Affiliation,Non-Academic Detected
40072452,Evaluation of the European Organisation for Research and Treatment of Cancer Quality of Life Questionnaire Core 15 Palliative Care and the Functional Assessment of Chronic Illness Therapy-Palliative in assessing the quality of life in patients with advanced cancer.,2025 Mar 12,"Tur P, Oldenburger E, Bottomley A, Cella D, Lee SF, Chan AW, Marta GN, Jacobs T, Chow E, Wong HCY, Rembielak A",N/A,N/A,N/A,"Unknown, Unknown, Unknown, Unknown, Unknown, Unknown, Unknown, Unknown, Unknown, Unknown, Unknown",No
40072444,Risk Prediction Models for Sentinel Node Positivity in Melanoma: A Systematic Review and Meta-Analysis.,2025 Mar 12,"Ma B, Gandhi M, Czyz S, Jia J, Rankin B, Osman S, Jonsson EL, Robertson L, Parsons L, Temple-Oberle C",N/A,N/A,N/A,"Unknown, Unknown, Unknown, Unknown, Unknown, Unknown, Unknown, Unknown, Unknown, Unknown",No
40072437,Exercise and Psychosexual Education to Improve Sexual Function in Men With Prostate Cancer: A Randomized Clinical Trial.,2025 Mar 3,"Galvão DA, Newton RU, Taaffe DR, Cormie P, Schumacher O, Nelson CJ, Gardiner RA, Spry N, Joseph D, Tang C, Luo H, Chee R, Hayne D, Chambers SK",N/A,N/A,N/A,"Unknown, Unknown, Unknown, Unknown, Unknown, Unknown, Unknown, Unknown, Unknown, Unknown, Unknown, Unknown, Unknown, Unknown",No
40072432,Frailty Trajectories Following Adjuvant Chemotherapy and Mortality in Older Women With Breast Cancer.,2025 Mar 3,"Duchesneau ED, Kim DH, Stürmer T, Her Q, Zhang Z, Pajewski NM, Klepin HD, Callahan KE, Lund JL",N/A,N/A,N/A,"Unknown, Unknown, Unknown, Unknown, Unknown, Unknown, Unknown, Unknown, Unknown",No
40072429,Estimation and Hypothesis Testing of Strain-Specific Vaccine Efficacy With Missing Strain Types With Application to a COVID-19 Vaccine Trial.,2025 Mar 15,"Heng F, Sun Y, Li L, B Gilbert P",N/A,N/A,N/A,"Unknown, Unknown, Unknown, Unknown",No
