PubmedID,Title,Publication Date,Authors,Email,Email Domain,DOI Link,Non-Academic Authors,Company Affiliation,Non-Academic Detected
40072452,Evaluation of the European Organisation for Research and Treatment of Cancer Quality of Life Questionnaire Core 15 Palliative Care and the Functional Assessment of Chronic Illness Therapy-Palliative in assessing the quality of life in patients with advanced cancer.,2025 Mar 12,"Tur P, Oldenburger E, Bottomley A, Cella D, Lee SF, Chan AW, Marta GN, Jacobs T, Chow E, Wong HCY, Rembielak A",N/A,N/A,https://doi.org/10.1097/SPC.0000000000000750,N/A,Not Available,No
40072444,Risk Prediction Models for Sentinel Node Positivity in Melanoma: A Systematic Review and Meta-Analysis.,2025 Mar 12,"Ma B, Gandhi M, Czyz S, Jia J, Rankin B, Osman S, Jonsson EL, Robertson L, Parsons L, Temple-Oberle C",N/A,N/A,https://doi.org/10.1001/jamadermatol.2025.0113,N/A,"Division of Dermatology, Department of Medicine, Cumming School of Medicine, University of Calgary, Calgary, Alberta, Canada, Department of Medicine, Cumming School of Medicine, University of Calgary, Calgary, Alberta, Canada, Department of Medicine, Cumming School of Medicine, University of Calgary, Calgary, Alberta, Canada, Division of Dermatology, Department of Medicine, Cumming School of Medicine, University of Calgary, Calgary, Alberta, Canada, Division of Dermatology, Department of Medicine, Cumming School of Medicine, University of Calgary, Calgary, Alberta, Canada, Division of Dermatology, Department of Medicine, Cumming School of Medicine, University of Calgary, Calgary, Alberta, Canada, Department of Surgery, Arthur J.E. Child Comprehensive Cancer Centre, University of Calgary, Calgary, Alberta, Canada, Division of Dermatology, Department of Medicine, Cumming School of Medicine, University of Calgary, Calgary, Alberta, Canada, Division of Dermatology, Department of Medicine, Cumming School of Medicine, University of Calgary, Calgary, Alberta, Canada, Department of Surgery, Arthur J.E. Child Comprehensive Cancer Centre, University of Calgary, Calgary, Alberta, Canada",No
40072437,Exercise and Psychosexual Education to Improve Sexual Function in Men With Prostate Cancer: A Randomized Clinical Trial.,2025 Mar 3,"Galvão DA, Newton RU, Taaffe DR, Cormie P, Schumacher O, Nelson CJ, Gardiner RA, Spry N, Joseph D, Tang C, Luo H, Chee R, Hayne D, Chambers SK",N/A,N/A,https://doi.org/10.1001/jamanetworkopen.2025.0413,N/A,"Exercise Medicine Research Institute, Edith Cowan University, Perth, Australia, Exercise Medicine Research Institute, Edith Cowan University, Perth, Australia, Exercise Medicine Research Institute, Edith Cowan University, Perth, Australia, Peter MacCallum Cancer Centre, Melbourne, Australia, Exercise Medicine Research Institute, Edith Cowan University, Perth, Australia, Department of Psychiatry and Behavioral Sciences, Memorial Sloan Kettering Cancer Center, New York, New York, Exercise Medicine Research Institute, Edith Cowan University, Perth, Australia, Exercise Medicine Research Institute, Edith Cowan University, Perth, Australia, Exercise Medicine Research Institute, Edith Cowan University, Perth, Australia, Exercise Medicine Research Institute, Edith Cowan University, Perth, Australia, Exercise Medicine Research Institute, Edith Cowan University, Perth, Australia, Exercise Medicine Research Institute, Edith Cowan University, Perth, Australia, UWA Medical School, University of Western Australia, Perth, Australia, Exercise Medicine Research Institute, Edith Cowan University, Perth, Australia",No
40072432,Frailty Trajectories Following Adjuvant Chemotherapy and Mortality in Older Women With Breast Cancer.,2025 Mar 3,"Duchesneau ED, Kim DH, Stürmer T, Her Q, Zhang Z, Pajewski NM, Klepin HD, Callahan KE, Lund JL",N/A,N/A,https://doi.org/10.1001/jamanetworkopen.2025.0614,N/A,"Division of Public Health Sciences, Department of Epidemiology and Prevention, Wake Forest University School of Medicine, Winston-Salem, North Carolina, Hinda and Arthur Marcus Institute for Aging Research, Hebrew SeniorLife, Harvard Medical School, Boston, Massachusetts, Department of Epidemiology, Gillings School of Global Public Health, University of North Carolina at Chapel Hill, Chapel Hill, Department of Epidemiology, Gillings School of Global Public Health, University of North Carolina at Chapel Hill, Chapel Hill, Department of Health Policy and Management, Gillings School of Global Public Health, University of North Carolina at Chapel Hill, Chapel Hill, Division of Public Health Sciences, Department of Biostatistics and Data Science, Wake Forest University School of Medicine, Winston-Salem, North Carolina, Section on Hematology and Oncology, Department of Internal Medicine, Wake Forest University School of Medicine, Winston-Salem, North Carolina, Section on Gerontology and Geriatric Medicine, Department of Internal Medicine, Wake Forest University School of Medicine, Winston-Salem, North Carolina, Department of Epidemiology, Gillings School of Global Public Health, University of North Carolina at Chapel Hill, Chapel Hill",No
40072429,Estimation and Hypothesis Testing of Strain-Specific Vaccine Efficacy With Missing Strain Types With Application to a COVID-19 Vaccine Trial.,2025 Mar 15,"Heng F, Sun Y, Li L, B Gilbert P",N/A,N/A,https://doi.org/10.1002/sim.10345,N/A,Not Available,No
